{
  "$schema": "https://json-schema.org/draft/2020-12/schema",
  "$id": "urn:chess-tabiya:schema:shape-entry:0.2",
  "title": "Tabiya Shape Entry",
  "type": "object",
  "required": ["id", "version", "name", "phases", "trigger", "plans", "watch", "typicalMistakes", "provenance"],
  "properties": {
    "id": { "$ref": "#/$defs/id" },
    "version": { "$ref": "#/$defs/semver" },
    "name": { "$ref": "#/$defs/nonEmptyString" },
    "phases": { "type": "array", "minItems": 1, "uniqueItems": true, "items": { "enum": ["opening", "middlegame", "endgame"] } },
    "trigger": { "$ref": "#/$defs/structuralExpression" },
    "plans": { "type": "array", "minItems": 1, "items": { "$ref": "#/$defs/plan" } },
    "watch": { "type": "array", "minItems": 1, "items": { "$ref": "#/$defs/nonEmptyString" } },
    "typicalMistakes": { "type": "array", "minItems": 1, "items": { "$ref": "#/$defs/nonEmptyString" } },
    "provenance": { "$ref": "#/$defs/provenance" }
  },
  "additionalProperties": false,
  "$defs": {
    "nonEmptyString": { "type": "string", "minLength": 1 },
    "id": { "type": "string", "pattern": "^[a-z0-9][a-z0-9-]*$" },
    "semver": { "type": "string", "pattern": "^(0|[1-9][0-9]*)\\.(0|[1-9][0-9]*)\\.(0|[1-9][0-9]*)(?:-[0-9A-Za-z-]+(?:\\.[0-9A-Za-z-]+)*)?(?:\\+[0-9A-Za-z-]+(?:\\.[0-9A-Za-z-]+)*)?$" },
    "square": { "type": "string", "pattern": "^[a-h][1-8]$" },
    "file": { "type": "string", "pattern": "^[a-h]$" },
    "piece": { "type": "object", "required": ["color", "role"], "properties": { "color": { "enum": ["white", "black"] }, "role": { "enum": ["pawn", "knight", "bishop", "rook", "queen", "king"] } }, "additionalProperties": false },
    "fileRange": { "type": "object", "required": ["from", "to"], "properties": { "from": { "$ref": "#/$defs/file" }, "to": { "$ref": "#/$defs/file" } }, "additionalProperties": false },
    "rankRange": { "type": "object", "required": ["from", "to"], "properties": { "from": { "type": "integer", "minimum": 1, "maximum": 8 }, "to": { "type": "integer", "minimum": 1, "maximum": 8 } }, "additionalProperties": false },
    "squareRegion": { "type": "object", "required": ["files", "ranks"], "properties": { "files": { "$ref": "#/$defs/fileRange" }, "ranks": { "$ref": "#/$defs/rankRange" } }, "additionalProperties": false },
    "fileTemplateFeature": {
      "oneOf": [
        { "type": "object", "required": ["kind", "color"], "properties": { "kind": { "const": "backward_pawn" }, "color": { "enum": ["white", "black"] } }, "additionalProperties": false },
        { "type": "object", "required": ["kind", "color"], "properties": { "kind": { "const": "isolated_pawn" }, "color": { "enum": ["white", "black"] } }, "additionalProperties": false },
        { "type": "object", "required": ["kind", "color"], "properties": { "kind": { "const": "doubled_pawn" }, "color": { "enum": ["white", "black"] } }, "additionalProperties": false },
        { "type": "object", "required": ["kind", "color"], "properties": { "kind": { "const": "half_open_file" }, "color": { "enum": ["white", "black"] } }, "additionalProperties": false },
        { "type": "object", "required": ["kind"], "properties": { "kind": { "const": "open_file" } }, "additionalProperties": false }
      ]
    },
    "squareTemplateFeature": {
      "oneOf": [
        { "type": "object", "required": ["kind", "color"], "properties": { "kind": { "const": "pawn_safe_square" }, "color": { "enum": ["white", "black"] } }, "additionalProperties": false },
        { "type": "object", "required": ["kind", "color"], "properties": { "kind": { "const": "outpost" }, "color": { "enum": ["white", "black"] } }, "additionalProperties": false },
        { "type": "object", "required": ["kind", "color"], "properties": { "kind": { "const": "passed_pawn" }, "color": { "enum": ["white", "black"] } }, "additionalProperties": false },
        { "type": "object", "required": ["kind", "color", "comparison", "count"], "properties": { "kind": { "const": "direct_attack_count" }, "color": { "enum": ["white", "black"] }, "comparison": { "enum": ["atLeast", "atMost", "equal"] }, "count": { "type": "integer" } }, "additionalProperties": false },
        { "type": "object", "required": ["kind", "piece"], "properties": { "kind": { "const": "piece" }, "piece": { "oneOf": [{ "$ref": "#/$defs/piece" }, { "type": "null" }] } }, "additionalProperties": false }
      ]
    },
    "structuralFeature": {
      "oneOf": [
        { "type": "object", "required": ["kind", "color", "square"], "properties": { "kind": { "const": "pawn_safe_square" }, "color": { "enum": ["white", "black"] }, "square": { "$ref": "#/$defs/square" } }, "additionalProperties": false },
        { "type": "object", "required": ["kind", "color", "square"], "properties": { "kind": { "const": "outpost" }, "color": { "enum": ["white", "black"] }, "square": { "$ref": "#/$defs/square" } }, "additionalProperties": false },
        { "type": "object", "required": ["kind", "color", "file"], "properties": { "kind": { "const": "backward_pawn" }, "color": { "enum": ["white", "black"] }, "file": { "$ref": "#/$defs/file" } }, "additionalProperties": false },
        { "type": "object", "required": ["kind", "color", "file"], "properties": { "kind": { "const": "isolated_pawn" }, "color": { "enum": ["white", "black"] }, "file": { "$ref": "#/$defs/file" } }, "additionalProperties": false },
        { "type": "object", "required": ["kind", "color", "file"], "properties": { "kind": { "const": "doubled_pawn" }, "color": { "enum": ["white", "black"] }, "file": { "$ref": "#/$defs/file" } }, "additionalProperties": false },
        { "type": "object", "required": ["kind", "color", "square"], "properties": { "kind": { "const": "passed_pawn" }, "color": { "enum": ["white", "black"] }, "square": { "$ref": "#/$defs/square" } }, "additionalProperties": false },
        { "type": "object", "required": ["kind", "file"], "properties": { "kind": { "const": "open_file" }, "file": { "$ref": "#/$defs/file" } }, "additionalProperties": false },
        { "type": "object", "required": ["kind", "color", "file"], "properties": { "kind": { "const": "half_open_file" }, "color": { "enum": ["white", "black"] }, "file": { "$ref": "#/$defs/file" } }, "additionalProperties": false },
        { "type": "object", "required": ["kind", "from", "to", "comparison", "count"], "properties": { "kind": { "const": "line_blockers" }, "from": { "$ref": "#/$defs/square" }, "to": { "$ref": "#/$defs/square" }, "comparison": { "enum": ["atLeast", "atMost", "equal"] }, "count": { "type": "integer" } }, "additionalProperties": false },
        { "type": "object", "required": ["kind", "square", "color", "comparison", "count"], "properties": { "kind": { "const": "direct_attack_count" }, "square": { "$ref": "#/$defs/square" }, "color": { "enum": ["white", "black"] }, "comparison": { "enum": ["atLeast", "atMost", "equal"] }, "count": { "type": "integer" } }, "additionalProperties": false },
        { "type": "object", "required": ["kind", "color", "role", "scope", "comparison", "count"], "properties": { "kind": { "const": "piece_reach_count" }, "color": { "enum": ["white", "black"] }, "role": { "enum": ["knight", "bishop", "rook", "queen"] }, "scope": { "enum": ["any", "every"] }, "comparison": { "enum": ["atLeast", "atMost", "equal"] }, "count": { "type": "integer" } }, "additionalProperties": false },
        { "type": "object", "required": ["kind", "id"], "properties": { "kind": { "const": "named_structure" }, "id": { "enum": ["carlsbad", "iqp-white", "iqp-black", "maroczy-bind"] } }, "additionalProperties": false },
        { "type": "object", "required": ["kind", "color", "shade"], "properties": { "kind": { "const": "bishop_on_shade" }, "color": { "enum": ["white", "black"] }, "shade": { "enum": ["light", "dark"] } }, "additionalProperties": false },
        { "type": "object", "required": ["kind", "color", "basis", "comparison", "count"], "properties": { "kind": { "const": "pawn_count" }, "color": { "enum": ["white", "black"] }, "basis": { "enum": ["count", "difference"] }, "comparison": { "enum": ["atLeast", "atMost", "equal"] }, "count": { "type": "integer" } }, "additionalProperties": false },
        { "type": "object", "required": ["kind", "color", "form"], "properties": { "kind": { "const": "king_opposition" }, "color": { "enum": ["white", "black"] }, "form": { "enum": ["direct", "distant"] } }, "additionalProperties": false }
      ]
    },
    "structuralExpression": {
      "oneOf": [
        { "type": "object", "required": ["kind", "of"], "properties": { "kind": { "enum": ["all", "any"] }, "of": { "type": "array", "minItems": 1, "items": { "$ref": "#/$defs/structuralExpression" } } }, "additionalProperties": false },
        { "type": "object", "required": ["kind", "of"], "properties": { "kind": { "const": "not" }, "of": { "$ref": "#/$defs/structuralExpression" } }, "additionalProperties": false },
        { "type": "object", "required": ["kind", "feature"], "properties": { "kind": { "const": "feature" }, "feature": { "$ref": "#/$defs/structuralFeature" } }, "additionalProperties": false },
        { "type": "object", "required": ["kind", "axis", "of"], "properties": { "kind": { "const": "mirrored" }, "axis": { "enum": ["colors", "files", "both"] }, "of": { "$ref": "#/$defs/structuralExpression" } }, "additionalProperties": false },
        { "type": "object", "required": ["kind", "quantifier", "over", "feature"], "properties": { "kind": { "const": "quantified" }, "quantifier": { "enum": ["some", "every"] }, "over": { "type": "object", "required": ["files"], "properties": { "files": { "$ref": "#/$defs/fileRange" } }, "additionalProperties": false }, "feature": { "$ref": "#/$defs/fileTemplateFeature" } }, "additionalProperties": false },
        { "type": "object", "required": ["kind", "quantifier", "over", "feature"], "properties": { "kind": { "const": "quantified" }, "quantifier": { "enum": ["some", "every"] }, "over": { "type": "object", "required": ["squares"], "properties": { "squares": { "$ref": "#/$defs/squareRegion" } }, "additionalProperties": false }, "feature": { "$ref": "#/$defs/squareTemplateFeature" } }, "additionalProperties": false },
        { "type": "object", "required": ["kind", "square", "piece"], "properties": { "kind": { "const": "pieceOnSquare" }, "square": { "$ref": "#/$defs/square" }, "piece": { "oneOf": [{ "$ref": "#/$defs/piece" }, { "type": "null" }] } }, "additionalProperties": false }
      ]
    },
    "plan": { "type": "object", "required": ["id", "side", "label", "description", "success"], "properties": { "id": { "$ref": "#/$defs/id" }, "side": { "enum": ["white", "black"] }, "label": { "$ref": "#/$defs/nonEmptyString" }, "description": { "$ref": "#/$defs/nonEmptyString" }, "success": { "type": "object", "required": ["note", "signature"], "properties": { "note": { "$ref": "#/$defs/nonEmptyString" }, "signature": { "oneOf": [{ "$ref": "#/$defs/structuralExpression" }, { "type": "null" }] } }, "additionalProperties": false } }, "additionalProperties": false },
    "attribution": { "type": "object", "required": ["title", "author", "licence"], "properties": { "title": { "$ref": "#/$defs/nonEmptyString" }, "author": { "$ref": "#/$defs/nonEmptyString" }, "url": { "type": "string", "format": "uri" }, "licence": { "$ref": "#/$defs/nonEmptyString" } }, "additionalProperties": false },
    "provenance": { "type": "object", "required": ["licence", "sources", "attribution"], "properties": { "licence": { "$ref": "#/$defs/nonEmptyString" }, "sources": { "type": "array", "minItems": 1, "items": { "$ref": "#/$defs/nonEmptyString" } }, "attribution": { "type": "array", "items": { "$ref": "#/$defs/attribution" } } }, "additionalProperties": false }
  }
}
