{
  "id": "hanging-pawns",
  "version": "0.1.0",
  "name": "Hanging pawns (Black pair on c5 and d5)",
  "phases": ["middlegame"],
  "trigger": { "kind": "all", "of": [{ "kind": "pieceOnSquare", "square": "c5", "piece": { "color": "black", "role": "pawn" } }, { "kind": "pieceOnSquare", "square": "d5", "piece": { "color": "black", "role": "pawn" } }, { "kind": "feature", "feature": { "kind": "half_open_file", "color": "white", "file": "c" } }, { "kind": "feature", "feature": { "kind": "half_open_file", "color": "white", "file": "d" } }, { "kind": "any", "of": [{ "kind": "feature", "feature": { "kind": "half_open_file", "color": "black", "file": "b" } }, { "kind": "feature", "feature": { "kind": "open_file", "file": "b" } }] }, { "kind": "any", "of": [{ "kind": "feature", "feature": { "kind": "half_open_file", "color": "black", "file": "e" } }, { "kind": "feature", "feature": { "kind": "open_file", "file": "e" } }] }] },
  "plans": [
    { "id": "black-advance-the-pair", "side": "black", "label": "Advance the pair", "description": "The pair's dynamic life: push the d-pawn with piece support to open lines and plant a wedge before the pawns become targets.", "success": { "note": "The pair advanced intact: the d-pawn stands on d4 with the c-pawn still beside it.", "signature": { "kind": "all", "of": [{ "kind": "pieceOnSquare", "square": "d4", "piece": { "color": "black", "role": "pawn" } }, { "kind": "pieceOnSquare", "square": "c5", "piece": { "color": "black", "role": "pawn" } }] } } },
    { "id": "black-file-pressure", "side": "black", "label": "Use the flanking files", "description": "Put rooks on the half-open b- and e-files the pair's birth opened, so the pawns are a spearhead and not only a liability.", "success": { "note": "A Black rook on the b-file and a Black rook on the e-file — the two flanking files the pair's birth opened. The plan names the squares, so the census is literal. It counts placement, not what the placement is worth.", "signature": { "kind": "all", "of": [{ "kind": "quantified", "quantifier": "some", "over": { "squares": { "files": { "from": "b", "to": "b" }, "ranks": { "from": 1, "to": 8 } } }, "feature": { "kind": "piece", "piece": { "color": "black", "role": "rook" } } }, { "kind": "quantified", "quantifier": "some", "over": { "squares": { "files": { "from": "e", "to": "e" }, "ranks": { "from": 1, "to": 8 } } }, "feature": { "kind": "piece", "piece": { "color": "black", "role": "rook" } } }] } } },
    { "id": "black-keep-the-pieces", "side": "black", "label": "Queens on while the pair stands", "description": "The pair lives on piece energy: keep the queens on the board while the pawns still stand on c5 and d5.", "success": { "note": "RESTATED PLAN. The plan was 'Keep pieces on', whose success was what the avoided trades were worth. It is now the state the plan is defending: the pair still stands on c5 and d5 and both queens are still on the board. Queens are the piece the plan is really about; the minor pieces are not counted. Original success note: 'Detection cannot count what a trade was worth.'", "signature": { "kind": "all", "of": [{ "kind": "pieceOnSquare", "square": "c5", "piece": { "color": "black", "role": "pawn" } }, { "kind": "pieceOnSquare", "square": "d5", "piece": { "color": "black", "role": "pawn" } }, { "kind": "feature", "feature": { "kind": "piece_count", "color": "white", "role": "queen", "basis": "count", "comparison": "atLeast", "count": 1 } }, { "kind": "feature", "feature": { "kind": "piece_count", "color": "black", "role": "queen", "basis": "count", "comparison": "atLeast", "count": 1 } }] } } },
    { "id": "white-provoke-and-degrade", "side": "white", "label": "Provoke and degrade", "description": "Pile on the pawns, provoke an advance, blockade the square the advance left behind, and win the straggler.", "success": { "note": "The pair degraded: one pawn fell or was traded off, leaving the survivor isolated.", "signature": { "kind": "any", "of": [{ "kind": "feature", "feature": { "kind": "isolated_pawn", "color": "black", "file": "c" } }, { "kind": "feature", "feature": { "kind": "isolated_pawn", "color": "black", "file": "d" } }] } } },
    { "id": "white-trade-the-energy", "side": "white", "label": "Queens off with the pair still fixed", "description": "Exchange the queens that give the pair its dynamism and leave the pawns on c5 and d5 as something to attack.", "success": { "note": "RESTATED PLAN. The plan was 'Trade the active pieces', whose success was what the trades were worth. It is now the exact opposite state of the plan it opposes: the queens are off and the pair is still sitting on c5 and d5, a static target. Original success note: 'Detection cannot count what a trade was worth.'", "signature": { "kind": "all", "of": [{ "kind": "pieceOnSquare", "square": "c5", "piece": { "color": "black", "role": "pawn" } }, { "kind": "pieceOnSquare", "square": "d5", "piece": { "color": "black", "role": "pawn" } }, { "kind": "feature", "feature": { "kind": "piece_count", "color": "white", "role": "queen", "basis": "count", "comparison": "equal", "count": 0 } }, { "kind": "feature", "feature": { "kind": "piece_count", "color": "black", "role": "queen", "basis": "count", "comparison": "equal", "count": 0 } }] } } }
  ],
  "watch": ["The attacker and defender counts on d4, the square the pair most wants to cross.", "Whether each pawn still has its partner beside it.", "Who controls the blockading squares c4 and d4 if a pawn advances."],
  "typicalMistakes": ["Advancing one pawn to win a tempo and leaving the pair split.", "Trading the pieces that made the pawns dynamic, then defending them forever.", "Besieging the pawns head-on while the supported advance is still available."],
  "provenance": { "licence": "CC-BY-SA-4.0", "sources": ["UNGROUNDED: agent-authored strategic claims with no citation, engine evaluation, corpus frequency, or owner review; standard hanging-pawns doctrine rendered from model knowledge.", "Trigger narrowing: the family is colour-symmetric and square-flexible; this entry encodes only the Black pair on the canonical c5 and d5 squares (the QGD Tartakower shape). The White mirror on c4 and d4, and pairs that have already advanced, do not fire; no predicate quantifies over files, so each orientation must be enumerated square by square."], "attribution": [] }
}
